titles,summary,genre,year
The Hidden,Law abiding people suddenly become violent criminals. A cop and an FBI agent race for answers in this sci-fi thriller.,"Horror, Sci-Fi, Thriller",1987
Dirty Dancing,"Spending the summer at a Catskills resort with her family, Frances ""Baby"" Houseman falls in love with the camp's dance instructor, Johnny Castle.","Drama, Music, Romance",1987
River's Edge,"A high school slacker commits a shocking act and proceeds to let his friends in on the secret. However, the friends' reaction is almost as ambiguous and perplexing as the crime itself.","Crime, Drama",1986
Little Shop of Horrors,A nerdy florist finds his chance for success and romance with the help of a giant man-eating plant who demands to be fed.,"Comedy, Horror, Musical",1986
The Color of Money,"Fast Eddie Felson teaches a cocky but immensely talented protégé the ropes of pool hustling, which in turn inspires him to make an unlikely comeback.","Drama, Sport",1986
At Close Range,"In 1978 Pennsylvania, an absentee father is reacquainted with his estranged teenage sons who become intrigued with his romanticized life of crime.","Crime, Drama",1986
The Sure Thing,College freshman Walter (Gib) Gibson decides to go cross country to visit his friend in California during winter break. Awaiting there is a bikini-clad babe whom his friend assures him is a... See full summary »,"Comedy, Drama, Romance",1985
Real Genius,"Teenage geniuses deal with their abilities while developing a high-powered laser for a university project. When their professor intends to turn their work into a military weapon, they decide to ruin his plans.","Comedy, Romance, Sci-Fi",1985
Pee-wee's Big Adventure,"When eccentric man-child Pee-wee Herman gets his beloved bike stolen in broad daylight, he sets out across the U.S. on the adventure of his life.","Adventure, Comedy, Family",1985
Ladyhawke,"The thief Gaston escapes dungeon of medieval Aquila thru the latrine. Soldiers are about to kill him when Navarre saves him. Navarre, traveling with his spirited hawk, plans to kill the bishop of Aquila with help from Gaston.","Adventure, Comedy, Drama",1985
Starman,An alien takes the form of a young widow's husband and asks her to drive him from Wisconsin to Arizona. The government tries to stop them.,"Romance, Sci-Fi",1984
The Bounty,"Fed up with their Captain's harsh discipline, a sailing ship's crew decides to take action.","Adventure, Drama, History",1984
An Officer and a Gentleman,"A young man must complete his work at a Navy Officer Candidate School to become an aviator, with the help of a tough Gunnery Sergeant and his new girlfriend.","Drama, Romance",1982
Deathtrap,A Broadway playwright puts murder in his plan to take credit for a student's play.,"Comedy, Crime, Mystery",1982
Up in Smoke,"Two stoners unknowingly smuggle a van - made entirely of marijuana - from Mexico to L.A., with incompetent Sgt. Stedenko on their trail.","Comedy, Music",1978
The Boys from Brazil,A Nazi hunter in Paraguay discovers a sinister and bizarre plot to rekindle the Third Reich.,"Drama, Mystery, Thriller",1978
Smokey and the Bandit,"The Bandit is hired on to run a tractor trailer full of beer over state lines, in hot pursuit by a pesky sheriff.","Action, Comedy",1977
The Towering Inferno,"At the opening party of a colossal, but poorly constructed, office building, a massive fire breaks out that threatens to destroy the tower and everyone in it.","Action, Drama, Thriller",1974
Death Wish,A New York City architect becomes a one-man vigilante squad after his wife is murdered by street punks in which he randomly goes out and kills would-be muggers on the mean streets after dark.,"Action, Crime, Drama",1974
Westworld,"A robot malfunction creates havoc and terror for unsuspecting vacationers at a futuristic, adult-themed amusement park.","Action, Sci-Fi, Thriller",1973
Play Misty for Me,The life of a disc jockey is turned upside down after a romantic encounter with an obsessed fan.,"Drama, Thriller",1971
Carnal Knowledge,Chronicling the lifelong sexual development of two men who meet and befriend one another in college.,Drama,1971
Bananas,"When a bumbling New Yorker is dumped by his activist girlfriend, he travels to a tiny Latin American nation and becomes involved in its latest rebellion.",Comedy,1971
Zabriskie Point,"At Zabriskie Point, United States' lowest point, two perfect strangers meet; an undergraduate dreamer and a young hippie student who start off an unrestrained romance, making love on the dusty terrain.",Drama,1970
Two Mules for Sister Sara,"Nun Sara (Shirley MacLaine) is on the run in Mexico and is saved from cowboys by Hogan (Clint Eastwood), who is preparing for a future mission to capture a French fort. The pair become good friends, but Sara never does tell him the true reason behind her being outlawed.","Adventure, Romance, War",1970
The Thomas Crown Affair,"A debonair, adventuresome bank executive believes he has pulled off the perfect multi-million dollar heist, only to match wits with a sexy insurance investigator who will do anything to get her man.","Crime, Drama, Romance",1968
Hang 'Em High,"When an innocent man barely survives a lynching, he returns as a lawman determined to bring the vigilantes to justice.","Drama, Western",1968
Barefoot in the Park,"Paul, a conservative young lawyer, marries the vivacious Corie. Their highly passionate relationship descends into comical discord in a five-flight New York City walk-up apartment.","Comedy, Romance",1967
The Masque of the Red Death,"A European prince terrorizes the local peasantry while using his castle as a refuge against the ""Red Death"" plague that stalks the land.",Horror,1964
Cleopatra,Queen Cleopatra VII of Egypt experiences both triumph and tragedy as she attempts to resist the imperial ambitions of Rome.,"Biography, Drama, History",1963
House of Usher,"Upon entering his fiancée's family mansion, a man discovers a savage family curse and fears that his future brother-in-law has entombed his bride-to-be prematurely.","Drama, Horror",1960
Blinded by the Light,"In England in 1987, a teenager from an Asian family learns to live his life, understand his family and find his own voice through the music of American rock star Bruce Springsteen.","Comedy, Drama, Music",2019
Judy,Legendary performer Judy Garland arrives in London in the winter of 1968 to perform a series of sold-out concerts.,"Biography, Drama, Romance",2019
Boy Erased,The son of a Baptist preacher is forced to participate in a church-supported gay conversion program after being forcibly outed to his parents.,"Biography, Drama",2018
At Eternity's Gate,"A look at the life of painter Vincent van Gogh during the time he lived in Arles and Auvers-sur-Oise, France.","Biography, Drama",2018
Us,A family's serene beach vacation turns to chaos when their doppelgängers appear and begin to terrorize them.,"Horror, Mystery, Thriller",2019
Outlaw King,A true David vs. Goliath story of how the 14th century Scottish 'Outlaw King' Robert the Bruce used cunning and bravery to defeat the much larger and better equipped occupying English army.,"Action, Biography, Drama",2018
"Don't Worry, He Won't Get Far on Foot","On the rocky path to sobriety after a life-changing accident, John Callahan discovers the healing power of art, willing his injured hands into drawing hilarious, often controversial cartoons, which bring him a new lease on life.","Biography, Comedy, Drama",2018
A Ghost Story,"In this singular exploration of legacy, love, loss, and the enormity of existence, a recently deceased, white-sheeted ghost returns to his suburban home to try to reconnect with his bereft wife.","Drama, Fantasy, Romance",2017
The Lion King,"After the murder of his father, a young lion prince flees his kingdom only to learn the true meaning of responsibility and bravery.","Animation, Adventure, Drama",2019
Last Flag Flying,"Thirty years after they served together in Vietnam, a former Navy Corpsman Larry ""Doc"" Shepherd re-unites with his old buddies, former Marines Sal Nealon and Reverend Richard Mueller, to bury his son, a young Marine killed in the Iraq War.","Comedy, Drama, War",2017
I Don't Feel at Home in This World Anymore.,"When a depressed woman is burgled, she finds a new sense of purpose by tracking down the thieves alongside her obnoxious neighbour. But they soon find themselves dangerously out of their depth against a pack of degenerate criminals.","Comedy, Crime, Drama",2017
Sorry to Bother You,"In an alternate present-day version of Oakland, telemarketer Cassius Green discovers a magical key to professional success, propelling him into a universe of greed.","Comedy, Fantasy, Sci-Fi",2018
The Meyerowitz Stories,An estranged family gathers together in New York City for an event celebrating the artistic work of their father.,"Comedy, Drama",2017
Our Souls at Night,"Fonda and Redford star as Addie Moore and Louis Waters, a widow and widower who've lived next to each other for years. The pair have almost no relationship, but that all changes when Addie tries to make a connection with her neighbor.","Drama, Romance",2017
Christine,"The story of Christine Chubbuck, a 1970s TV reporter struggling with depression and professional frustrations as she tries to advance her career.","Biography, Drama",2016
Frozen II,"Anna, Elsa, Kristoff, Olaf and Sven leave Arendelle to travel to an ancient, autumn-bound forest of an enchanted land. They set out to find the origin of Elsa's powers in order to save their kingdom.","Animation, Adventure, Comedy",2019
The VVitch: A New-England Folktale,"A family in 1630s New England is torn apart by the forces of witchcraft, black magic, and possession.","Drama, Horror, Mystery",2015
Widows,"Set in contemporary Chicago, amid a time of turmoil, four women with nothing in common except a debt left behind by their dead husbands' criminal activities, take fate into their own hands, and conspire to forge a future on their own terms.","Crime, Drama, Thriller",2018
Captain Marvel,Carol Danvers becomes one of the universe's most powerful heroes when Earth is caught in the middle of a galactic war between two alien races.,"Action, Adventure, Sci-Fi",2019
A Prayer Before Dawn,The true story of an English boxer incarcerated in one of Thailand's most notorious prisons as he fights in Muay Thai tournaments to earn his freedom.,"Biography, Crime, Drama",2017
Stronger,"Stronger is the inspiring real life story of Jeff Bauman, an ordinary man who captured the hearts of his city and the world to become a symbol of hope after surviving the 2013 Boston Marathon bombing.","Biography, Drama",2017
Solo: A Star Wars Story,"During an adventure into the criminal underworld, Han Solo meets his future co-pilot Chewbacca and encounters Lando Calrissian years before joining the Rebellion.","Action, Adventure, Sci-Fi",2018
Legend,Identical twin gangsters Ronald and Reginald Kray terrorize London during the 1960s.,"Biography, Crime, Drama",2015
X-Men: Apocalypse,"In the 1980s the X-Men must defeat an ancient all-powerful mutant, En Sabah Nur, who intends to thrive through bringing destruction to the world.","Action, Adventure, Sci-Fi",2016
The Diary of a Teenage Girl,A teen artist living in 1970s San Francisco enters into an affair with her mother's boyfriend.,"Comedy, Drama, Romance",2015
Mr. Holmes,"An aged, retired Sherlock Holmes deals with early dementia, as he tries to remember his final case, and a mysterious woman, whose memory haunts him. He also befriends a fan, the young son of his housekeeper, who wants him to work again.","Drama, Mystery",2015
Beyond the Lights,"The pressures of fame have superstar singer Noni on the edge, until she meets Kaz, a young cop who works to help her find the courage to develop her own voice and break free to become the artist she was meant to be.","Drama, Music, Romance",2014
Crazy Rich Asians,"This contemporary romantic comedy, based on a global bestseller, follows native New Yorker Rachel Chu to Singapore to meet her boyfriend's family.","Comedy, Drama, Romance",2018
Camp X-Ray,A soldier assigned to Guantanamo Bay befriends a man who has been imprisoned there.,"Drama, War",2014
Everybody Wants Some!!,"In 1980, a group of college baseball players navigate their way through the freedoms and responsibilities of unsupervised adulthood.",Comedy,2016
Død snø 2,"Still on the run from a group of Nazi zombies, a man seeks the aid of a group of American zombie enthusiasts, and discovers new techniques for fighting the zombies.","Action, Comedy, Horror",2014
Annihilation,"A biologist signs up for a dangerous, secret expedition into a mysterious zone where the laws of nature don't apply.","Adventure, Drama, Horror",2018
Game Night,A group of friends who meet regularly for game nights find themselves entangled in a real-life mystery when the shady brother of one of them is seemingly kidnapped by dangerous gangsters.,"Action, Comedy, Crime",2018
Get on Up,A chronicle of James Brown's rise from extreme poverty to become one of the most influential musicians in history.,"Biography, Drama, Music",2014
The Magnificent Seven,Seven gunmen from a variety of backgrounds are brought together by a vengeful young widow to protect her town from the private army of a destructive industrialist.,"Action, Adventure, Western",2016
Joe,"An ex-con, who is the unlikeliest of role models, meets a 15-year-old boy and is faced with the choice of redemption or ruin.","Crime, Drama",2013
Jumanji: Welcome to the Jungle,"Four teenagers are sucked into a magical video game, and the only way they can escape is to work together to finish the game.","Action, Adventure, Comedy",2017
The Reluctant Fundamentalist,"A young Pakistani man is chasing corporate success on Wall Street. He finds himself embroiled in a conflict between his American Dream, a hostage crisis, and the enduring call of his family's homeland.","Drama, Thriller",2012
Non-Stop,"An air marshal springs into action during a transatlantic flight after receiving a series of text messages demanding $150 million into an off-shore account, or someone will die every 20 minutes.","Action, Mystery, Thriller",2014
All Is Lost,"After a collision with a shipping container at sea, a resourceful sailor finds himself, despite all efforts to the contrary, staring his mortality in the face.","Action, Adventure, Drama",2013
The 33,"Based on the real-life event, when a gold and copper mine collapses, it traps 33 miners underground for 69 days.","Biography, Drama, History",2015
The Upside,A comedic look at the relationship between a wealthy man with quadriplegia and an unemployed man with a criminal record who's hired to help him.,"Comedy, Drama",2017
Thor: The Dark World,"When the Dark Elves attempt to plunge the universe into darkness, Thor must embark on a perilous and personal journey that will reunite him with doctor Jane Foster.","Action, Adventure, Fantasy",2013
Labor Day,"Depressed single mom Adele and her son Henry offer a wounded, fearsome man a ride. As police search town for the escaped convict, the mother and son gradually learn his true story as their options become increasingly limited.","Drama, Romance, Thriller",2013
The Hitman's Bodyguard,"The world's top bodyguard gets a new client, a hitman who must testify at the International Criminal Court. They must put their differences aside and work together to make it to the trial on time.","Action, Comedy, Crime",2017
Nymphomaniac: Vol. I,A self-diagnosed nymphomaniac recounts her erotic experiences to the man who saved her after a beating.,Drama,2013
Trance,An art auctioneer becomes mixed up with a group of criminals partners with a hypnotherapist in order to recover a lost painting.,"Crime, Drama, Mystery",2013
The Highwaymen,The untold true story of the legendary detectives who brought down Bonnie and Clyde.,"Biography, Crime, Drama",2019
Pacific Rim,"As a war between humankind and monstrous sea creatures wages on, a former pilot and a trainee are paired up to drive a seemingly obsolete special weapon in a desperate effort to save the world from the apocalypse.","Action, Adventure, Sci-Fi",2013
Cinderella,"When her father unexpectedly dies, young Ella finds herself at the mercy of her cruel stepmother and her scheming stepsisters. Never one to give up hope, Ella's fortunes begin to change after meeting a dashing stranger.","Drama, Family, Fantasy",2015
Ted,"John Bennett, a man whose childhood wish of bringing his teddy bear to life came true, now must decide between keeping the relationship with the bear or his girlfriend, Lori.",Comedy,2012
Warm Bodies,"After a highly unusual zombie saves a still-living girl from an attack, the two form a relationship that sets in motion events that might transform the entire lifeless world.","Comedy, Horror, Romance",2013
Dolphin Tale,A story centered on the friendship between a boy and a dolphin whose tail was lost in a crab trap.,"Drama, Family",2011
What Happened to Monday,"In a world where families are limited to one child due to overpopulation, a set of identical septuplets must avoid being put to a long sleep by the government and dangerous infighting while investigating the disappearance of one of their own.","Action, Adventure, Crime",2017
Trust,A teenage girl is targeted by an online sexual predator.,"Crime, Drama, Thriller",2010
Anonymous,"The theory that it was in fact Edward De Vere, Earl of Oxford, who penned Shakespeare's plays. Set against the backdrop of the succession of Queen Elizabeth I and the Essex rebellion against her.","Drama, Thriller",2011
Horrible Bosses,Three friends conspire to murder their awful bosses when they realize they are standing in the way of their happiness.,"Comedy, Crime",2011
Martha Marcy May Marlene,"Haunted by painful memories and increasing paranoia, a damaged woman struggles to re-assimilate with her family after fleeing an abusive cult.","Drama, Mystery, Thriller",2011
Rio,"When Blu, a domesticated macaw from small-town Minnesota, meets the fiercely independent Jewel, he takes off on an adventure to Rio de Janeiro with the bird of his dreams.","Animation, Adventure, Comedy",2011
In the Heart of the Sea,"A recounting of a New England whaling ship's sinking by a giant whale in 1820, an experience that later inspired the great novel Moby-Dick.","Action, Adventure, Biography",2015
Black Mass,"The true story of Whitey Bulger, the brother of a state senator and the most infamous violent criminal in the history of South Boston, who became an FBI informant to take down a Mafia family invading his turf.","Biography, Crime, Drama",2015
World's Greatest Dad,"When his son's body is found in a humiliating accident, a lonely high school teacher inadvertently attracts an overwhelming amount of community and media attention after covering up the truth with a phony suicide note.","Comedy, Drama",2009
Legend of the Guardians: The Owls of Ga'Hoole,"When a young owl is abducted by an evil Owl army, he must escape with new-found friends and seek the legendary Guardians to stop the menace.","Animation, Action, Adventure",2010
Kill the Messenger,"Journalist Gary Webb, California 1996, started investigating CIA's role in the 1980s in getting crack cocaine to the black part of LA to get money and weapons to the Contras/freedom fighters in Nicaragua.","Biography, Crime, Drama",2014
Whip It,"In Bodeen, Texas, an indie-rock loving misfit finds a way of dealing with her small-town misery after she discovers a roller derby league in nearby Austin.","Drama, Sport",2009
Orphan,A husband and wife who recently lost their baby adopt a 9 year-old girl who is not nearly as innocent as she claims to be.,"Horror, Mystery, Thriller",2009
Frankenweenie,"When a boy's beloved dog passes away suddenly, he attempts to bring the animal back to life through a powerful science experiment.","Animation, Comedy, Family",2012
Free State of Jones,A disillusioned Confederate army deserter returns to Mississippi and leads a militia of fellow deserters and women in an uprising against the corrupt local Confederate government.,"Action, Biography, Drama",2016
Ice Age: Dawn of the Dinosaurs,"When Sid's attempt to adopt three dinosaur eggs gets him abducted by their real mother to an underground lost world, his friends attempt to rescue him.","Animation, Adventure, Comedy",2009
Ink,"A mysterious creature, known as Ink, steals a child's soul in hopes of using it as a bargaining chip to join the Incubi - the group of supernatural beings responsible for creating nightmares.","Action, Drama, Fantasy",2009
Water for Elephants,"Set in the 1930s, a former veterinary student takes a job in a travelling circus and falls in love with the ringmaster's wife.","Drama, Romance",2011
The Book of Eli,"A post-apocalyptic tale, in which a lone man fights his way across America in order to protect a sacred book that holds the secrets to saving humankind.","Action, Adventure, Drama",2010
The Lucky Ones,Three different soldiers - a woman and two men - return from war and facing the peaceful life's problems of each other.,"Comedy, Drama, War",2008
The Conspirator,"Mary Surratt is the lone female charged as a co-conspirator in the assassination trial of Abraham Lincoln. As the whole nation turns against her, she is forced to rely on her reluctant lawyer to uncover the truth and save her life.","Crime, Drama, History",2010
The Amazing Spider-Man,"After Peter Parker is bitten by a genetically altered spider, he gains newfound, spider-like powers and ventures out to save the city from the machinations of a mysterious reptilian foe.","Action, Adventure, Sci-Fi",2012
The Duchess,"A chronicle of the life of 18th-century aristocrat Georgiana, Duchess of Devonshire, who was reviled for her extravagant political and personal life.","Biography, Drama, History",2008
Cloudy with a Chance of Meatballs,"A local scientist is often regarded as a failure until he invents a machine that can make food fall from the sky. But little does he know, that things are about to take a turn for the worst.","Animation, Adventure, Comedy",2009
Step Brothers,Two aimless middle-aged losers still living at home are forced against their will to become roommates when their parents marry.,Comedy,2008
Towelhead,"A young Arab-American girl struggles with her sexual obsession, a bigoted Army reservist and her strict father during the Gulf War.",Drama,2007
Ocean's Thirteen,"Danny Ocean rounds up the boys for a third heist, after casino owner Willy Bank double-crosses one of the original eleven, Reuben Tishkoff.","Action, Crime, Thriller",2007
Miss Potter,"The story of Beatrix Potter, the author of the beloved and best-selling children's book, ""The Tale of Peter Rabbit"", and her struggle for love, happiness, and success.","Biography, Drama",2006
Crank,Professional assassin Chev Chelios learns his rival has injected him with a poison that will kill him if his heart rate drops.,"Action, Crime, Thriller",2006
Knocked Up,"For fun-loving party animal Ben Stone, the last thing he ever expected was for his one-night stand to show up on his doorstep eight weeks later to tell him she's pregnant with his child.","Comedy, Romance",2007
Extremely Loud & Incredibly Close,"A nine-year-old amateur inventor, Francophile, and pacifist searches New York City for the lock that matches a mysterious key left behind by his father, who died in the World Trade Center on September 11, 2001.","Adventure, Drama, Mystery",2011
Black Snake Moan,"A God-fearing bluesman takes to a wild young woman who, as a victim of childhood sexual abuse, looks everywhere for love, never quite finding it.","Drama, Music",2006
Inland Empire,"As an actress begins to adopt the persona of her character in a film, her world becomes nightmarish and surreal.","Drama, Mystery, Thriller",2006
The Devil Wears Prada,"A smart but sensible new graduate lands a job as an assistant to Miranda Priestly, the demanding editor-in-chief of a high fashion magazine.","Comedy, Drama",2006
Captain America: The First Avenger,"Steve Rogers, a rejected military soldier, transforms into Captain America after taking a dose of a ""Super-Soldier serum"". But being Captain America comes at a price as he attempts to take down a war monger and a terrorist organization.","Action, Adventure, Sci-Fi",2011
The Holiday,"Two women troubled with guy-problems swap homes in each other's countries, where they each meet a local guy and fall in love.","Comedy, Romance",2006
Goya's Ghosts,"Painter Francisco Goya faces a scandal involving his muse, who is labeled a heretic by a monk.","Biography, Drama, History",2006
Harsh Times,A tough-minded drama about two friends in South Central Los Angeles and the violence that comes between them.,"Action, Crime, Drama",2005
Alpha Dog,"Johnny and a couple pals kidnap Jake's 15-year-old brother, Zach, then assigns his buddy Frankie to be Zach's minder. They develop a brotherly friendship. Zach parties with his captors as things begin to spin out of control.","Biography, Crime, Drama",2006
Gridiron Gang,"Teenagers at a juvenile detention center, under the leadership of their counselor, gain self-esteem by playing football together.","Biography, Crime, Drama",2006
The Stanford Prison Experiment,"In 1971, twenty-four male students are selected to take on randomly assigned roles of prisoners and guards in a mock prison situated in the basement of the Stanford psychology building.","Biography, Drama, History",2015
Junebug,"A dealer in ""outsider"" art travels from Chicago to North Carolina to meet her new in-laws, challenging the equilibrium of this middle class Southern home.","Comedy, Drama",2005
