titles,summary,genre,year
The Shawshank Redemption,"Two imprisoned men bond over a number of years, finding solace and eventual redemption through acts of common decency.",Drama,1994
The Godfather,The aging patriarch of an organized crime dynasty transfers control of his clandestine empire to his reluctant son.,"Crime, Drama",1972
Wheels,Two suicidal paraplegic junkies hustle their way through the city streets trying to find a reason to live.,Drama,2014
The Dark Knight,"When the menace known as the Joker wreaks havoc and chaos on the people of Gotham, Batman must accept one of the greatest psychological and physical tests of his ability to fight injustice.","Action, Crime, Drama",2008
The Godfather: Part II,"The early life and career of Vito Corleone in 1920s New York City is portrayed, while his son, Michael, expands and tightens his grip on the family crime syndicate.","Crime, Drama",1974
The Lord of the Rings: The Return of the King,Gandalf and Aragorn lead the World of Men against Sauron's army to draw his gaze from Frodo and Sam as they approach Mount Doom with the One Ring.,"Adventure, Drama, Fantasy",2003
Pulp Fiction,"The lives of two mob hitmen, a boxer, a gangster and his wife, and a pair of diner bandits intertwine in four tales of violence and redemption.","Crime, Drama",1994
Schindler's List,"In German-occupied Poland during World War II, industrialist Oskar Schindler gradually becomes concerned for his Jewish workforce after witnessing their persecution by the Nazis.","Biography, Drama, History",1993
Inception,A thief who steals corporate secrets through the use of dream-sharing technology is given the inverse task of planting an idea into the mind of a C.E.O.,"Action, Adventure, Sci-Fi",2010
Fight Club,"An insomniac office worker and a devil-may-care soapmaker form an underground fight club that evolves into something much, much more.",Drama,1999
The Lord of the Rings: The Fellowship of the Ring,A meek Hobbit from the Shire and eight companions set out on a journey to destroy the powerful One Ring and save Middle-earth from the Dark Lord Sauron.,"Action, Adventure, Drama",2001
Forrest Gump,"The presidencies of Kennedy and Johnson, the events of Vietnam, Watergate and other historical events unfold through the perspective of an Alabama man with an IQ of 75, whose only desire is to be reunited with his childhood sweetheart.","Drama, Romance",1994
The Lord of the Rings: The Two Towers,"While Frodo and Sam edge closer to Mordor with the help of the shifty Gollum, the divided fellowship makes a stand against Sauron's new ally, Saruman, and his hordes of Isengard.","Adventure, Drama, Fantasy",2002
The Matrix,A computer hacker learns from mysterious rebels about the true nature of his reality and his role in the war against its controllers.,"Action, Sci-Fi",1999
Goodfellas,"The story of Henry Hill and his life in the mob, covering his relationship with his wife Karen Hill and his mob partners Jimmy Conway and Tommy DeVito in the Italian-American crime syndicate.","Biography, Crime, Drama",1990
Star Wars: Episode V - The Empire Strikes Back,"After the Rebels are brutally overpowered by the Empire on the ice planet Hoth, Luke Skywalker begins Jedi training with Yoda, while his friends are pursued by Darth Vader and a bounty hunter named Boba Fett all over the galaxy.","Action, Adventure, Fantasy",1980
One Flew Over the Cuckoo's Nest,"A criminal pleads insanity and is admitted to a mental institution, where he rebels against the oppressive nurse and rallies up the scared patients.",Drama,1975
Interstellar,A team of explorers travel through a wormhole in space in an attempt to ensure humanity's survival.,"Adventure, Drama, Sci-Fi",2014
Saving Private Ryan,"Following the Normandy Landings, a group of U.S. soldiers go behind enemy lines to retrieve a paratrooper whose brothers have been killed in action.","Drama, War",1998
The Green Mile,"The lives of guards on Death Row are affected by one of their charges: a black man accused of child murder and rape, yet who has a mysterious gift.","Crime, Drama, Fantasy",1999
Se7en,"Two detectives, a rookie and a veteran, hunt a serial killer who uses the seven deadly sins as his motives.","Crime, Drama, Mystery",1995
The Silence of the Lambs,"A young F.B.I. cadet must receive the help of an incarcerated and manipulative cannibal killer to help catch another serial killer, a madman who skins his victims.","Crime, Drama, Thriller",1991
Star Wars: Episode IV - A New Hope,"Luke Skywalker joins forces with a Jedi Knight, a cocky pilot, a Wookiee and two droids to save the galaxy from the Empire's world-destroying battle station, while also attempting to rescue Princess Leia from the mysterious Darth Vader.","Action, Adventure, Fantasy",1977
Joker,"In Gotham City, mentally troubled comedian Arthur Fleck is disregarded and mistreated by society. He then embarks on a downward spiral of revolution and bloody crime. This path brings him face-to-face with his alter-ego: the Joker.","Crime, Drama, Thriller",2019
Avengers: Infinity War,The Avengers and their allies must be willing to sacrifice all in an attempt to defeat the powerful Thanos before his blitz of devastation and ruin puts an end to the universe.,"Action, Adventure, Sci-Fi",2018
Whiplash,A promising young drummer enrolls at a cut-throat music conservatory where his dreams of greatness are mentored by an instructor who will stop at nothing to realize a student's potential.,"Drama, Music",2014
The Prestige,"After a tragic accident, two stage magicians engage in a battle to create the ultimate illusion while sacrificing everything they have to outwit each other.","Drama, Mystery, Sci-Fi",2006
The Departed,An undercover cop and a mole in the police attempt to identify each other while infiltrating an Irish gang in South Boston.,"Crime, Drama, Thriller",2006
Gladiator,A former Roman General sets out to exact vengeance against the corrupt emperor who murdered his family and sent him into slavery.,"Action, Adventure, Drama",2000
American History X,A former neo-nazi skinhead tries to prevent his younger brother from going down the same wrong path that he did.,Drama,1998
The Usual Suspects,"A sole survivor tells of the twisty events leading up to a horrific gun battle on a boat, which began when five criminals met at a seemingly random police lineup.","Crime, Mystery, Thriller",1995
Léon: The Professional,"Mathilda, a 12-year-old girl, is reluctantly taken in by Léon, a professional assassin, after her family is murdered. An unusual relationship forms as she becomes his protégée and learns the assassin's trade.","Action, Crime, Drama",1994
The Lion King,"A lion cub prince is tricked by a treacherous uncle into thinking he caused his father's death and flees into exile in despair, only to later accept in adulthood his identity and his responsibilities.","Animation, Adventure, Drama",1994
Terminator 2: Judgment Day,"A cyborg, identical to the one who failed to kill Sarah Connor, must now protect her teenage son, John Connor, from a more advanced and powerful cyborg.","Action, Sci-Fi",1991
Back to the Future,"Marty McFly, a 17-year-old high school student, is accidentally sent thirty years into the past in a time-traveling DeLorean invented by his close friend, the eccentric scientist Doc Brown.","Adventure, Comedy, Sci-Fi",1985
Once Upon a Time in the West,A mysterious stranger with a harmonica joins forces with a notorious desperado to protect a beautiful widow from a ruthless assassin working for the railroad.,Western,1968
Psycho,"A Phoenix secretary embezzles forty thousand dollars from her employer's client, goes on the run, and checks into a remote motel run by a young man under the domination of his mother.","Horror, Mystery, Thriller",1960
Capharnaüm,"While serving a five-year sentence for a violent crime, a 12-year-old boy sues his parents for neglect.",Drama,2018
Spider-Man: Into the Spider-Verse,"Teen Miles Morales becomes Spider-Man of his reality, crossing his path with five counterparts from other dimensions to stop a threat for all realities.","Animation, Action, Adventure",2018
Avengers: Endgame,"After the devastating events of Avengers: Infinity War (2018), the universe is in ruins. With the help of remaining allies, the Avengers assemble once more in order to reverse Thanos' actions and restore balance to the universe.","Action, Adventure, Drama",2019
Coco,"Aspiring musician Miguel, confronted with his family's ancestral ban on music, enters the Land of the Dead to find his great-great-grandfather, a legendary singer.","Animation, Adventure, Family",2017
Django Unchained,"With the help of a German bounty hunter, a freed slave sets out to rescue his wife from a brutal Mississippi plantation owner.","Drama, Western",2012
The Dark Knight Rises,"Eight years after the Joker's reign of anarchy, Batman, with the help of the enigmatic Catwoman, is forced from his exile to save Gotham City from the brutal guerrilla terrorist Bane.","Action, Adventure",2012
WALL·E,"In the distant future, a small waste-collecting robot inadvertently embarks on a space journey that will ultimately decide the fate of mankind.","Animation, Adventure, Family",2008
Memento,A man with short-term memory loss attempts to track down his wife's murderer.,"Mystery, Thriller",2000
Once Upon a Time in America,"A former Prohibition-era Jewish gangster returns to the Lower East Side of Manhattan over thirty years later, where he once again must confront the ghosts and regrets of his old life.","Crime, Drama",1984
Raiders of the Lost Ark,"In 1936, archaeologist and adventurer Indiana Jones is hired by the U.S. government to find the Ark of the Covenant before Adolf Hitler's Nazis can obtain its awesome powers.","Action, Adventure",1981
The Shining,"A family heads to an isolated hotel for the winter where a sinister presence influences the father into violence, while his psychic son sees horrific forebodings from both past and future.","Drama, Horror",1980
Lion of the Desert,"In 1929, Italian Fascist dictator Benito Mussolini appoints General Rodolfo Graziani as colonial governor to Italian Libya with orders to stamp-out all resistance from Libyan nationalists led by rebel guerrilla leader Omar Mukhtar.","Biography, Drama, History",1980
Apocalypse Now,A U.S. Army officer serving in Vietnam is tasked with assassinating a renegade Special Forces Colonel who sees himself as a god.,"Drama, Mystery, War",1979
Alien,"After a space merchant vessel receives an unknown transmission as a distress call, one of the crew is attacked by a mysterious life form and they soon realize that its life cycle has merely begun.","Horror, Sci-Fi",1979
Dr. Strangelove,An insane general triggers a path to nuclear holocaust that a War Room full of politicians and generals frantically tries to stop.,Comedy,1964
1917,"April 6th, 1917. As a regiment assembles to wage war deep in enemy territory, two soldiers are assigned to race against time and deliver a message that will stop 1,600 men from walking straight into a deadly trap.","Drama, War",2019
It's Such a Beautiful Day,"Bill struggles to put together his shattered psyche, in this new feature film version of Don Hertzfeldt's animated short film trilogy.","Animation, Comedy, Drama",2012
Toy Story 3,"The toys are mistakenly delivered to a day-care center instead of the attic right before Andy leaves for college, and it's up to Woody to convince the other toys that they weren't abandoned and to return home.","Animation, Adventure, Comedy",2010
Inglourious Basterds,"In Nazi-occupied France during World War II, a plan to assassinate Nazi leaders by a group of Jewish U.S. soldiers coincides with a theatre owner's vengeful plans for the same.","Adventure, Drama, War",2009
Eternal Sunshine of the Spotless Mind,"When their relationship turns sour, a couple undergoes a medical procedure to have each other erased from their memories.","Drama, Romance, Sci-Fi",2004
Snatch,"Unscrupulous boxing promoters, violent bookmakers, a Russian gangster, incompetent amateur robbers and supposedly Jewish jewelers fight to track down a priceless stolen diamond.","Comedy, Crime",2000
Requiem for a Dream,The drug-induced utopias of four Coney Island people are shattered when their addictions run deep.,Drama,2000
American Beauty,A sexually frustrated suburban father has a mid-life crisis after becoming infatuated with his daughter's best friend.,Drama,1999
Good Will Hunting,"Will Hunting, a janitor at M.I.T., has a gift for mathematics, but needs help from a psychologist to find direction in his life.","Drama, Romance",1997
Toy Story,A cowboy doll is profoundly threatened and jealous when a new spaceman figure supplants him as top toy in a boy's room.,"Animation, Adventure, Comedy",1995
Braveheart,"When his secret bride is executed for assaulting an English soldier who tried to rape her, William Wallace begins a revolt against King Edward I of England.","Biography, Drama, History",1995
Reservoir Dogs,"When a simple jewelry heist goes horribly wrong, the surviving criminals begin to suspect that one of them is a police informant.","Crime, Drama, Thriller",1992
Full Metal Jacket,A pragmatic U.S. Marine observes the dehumanizing effects the Vietnam War has on his fellow recruits from their brutal boot camp training to the bloody street fighting in Hue.,"Drama, War",1987
Aliens,"Ellen Ripley is rescued by a deep salvage team after being in hypersleep for 57 years. The moon that the Nostromo visited has been colonized, but contact is lost. This time, colonial marines have impressive firepower, but will that be enough?","Action, Adventure, Sci-Fi",1986
Amadeus,"The life, success and troubles of Wolfgang Amadeus Mozart, as told by Antonio Salieri, the contemporaneous composer who was insanely jealous of Mozart's talent and claimed to have murdered him.","Biography, Drama, History",1984
Scarface,"In 1980 Miami, a determined Cuban immigrant takes over a drug cartel and succumbs to greed.","Crime, Drama",1983
Star Wars: Episode VI - Return of the Jedi,"After a daring mission to rescue Han Solo from Jabba the Hutt, the Rebels dispatch to Endor to destroy the second Death Star. Meanwhile, Luke struggles to help Darth Vader back from the dark side without falling into the Emperor's trap.","Action, Adventure, Fantasy",1983
Taxi Driver,"A mentally unstable veteran works as a nighttime taxi driver in New York City, where the perceived decadence and sleaze fuels his urge for violent action by attempting to liberate a presidential campaign worker and an underage prostitute.","Crime, Drama",1976
The Sting,Two grifters team up to pull off the ultimate con.,"Comedy, Crime, Drama",1973
A Clockwork Orange,"In the future, a sadistic gang leader is imprisoned and volunteers for a conduct-aversion experiment, but it doesn't go as planned.","Crime, Drama, Sci-Fi",1971
2001: A Space Odyssey,"After discovering a mysterious artifact buried beneath the Lunar surface, mankind sets off on a quest to find its origins with help from intelligent supercomputer H.A.L. 9000.","Adventure, Sci-Fi",1968
The Apartment,"A man tries to rise in his company by letting its executives use his apartment for trysts, but complications and a romance of his own ensue.","Comedy, Drama, Romance",1960
Green Book,A working-class Italian-American bouncer becomes the driver of an African-American classical pianist on a tour of venues through the 1960s American South.,"Biography, Comedy, Drama",2018
"Three Billboards Outside Ebbing, Missouri",A mother personally challenges the local authorities to solve her daughter's murder when they fail to catch the culprit.,"Comedy, Crime, Drama",2017
Warrior,"The youngest son of an alcoholic former boxer returns home, where he's trained by his father for competition in a mixed martial arts tournament - a path that puts the fighter on a collision course with his estranged, older brother.","Drama, Sport",2011
Up,"78-year-old Carl Fredricksen travels to Paradise Falls in his house equipped with balloons, inadvertently taking a young stowaway.","Animation, Adventure, Comedy",2009
The Wolf of Wall Street,"Based on the true story of Jordan Belfort, from his rise to a wealthy stock-broker living the high life to his fall involving crime, corruption and the federal government.","Biography, Crime, Drama",2013
There Will Be Blood,"A story of family, religion, hatred, oil and madness, focusing on a turn-of-the-century prospector in the early days of the business.",Drama,2007
V for Vendetta,"In a future British tyranny, a shadowy freedom fighter, known only by the alias of ""V"", plots to overthrow it with the help of a young woman.","Action, Drama, Sci-Fi",2005
Batman Begins,"After training with his mentor, Batman begins his fight to free crime-ridden Gotham City from corruption.","Action, Adventure",2005
A Beautiful Mind,"After John Nash, a brilliant but asocial mathematician, accepts secret work in cryptography, his life takes a turn for the nightmarish.","Biography, Drama",2001
L.A. Confidential,"As corruption grows in 1950s Los Angeles, three policemen - one strait-laced, one brutal, and one sleazy - investigate a series of murders with their own brand of justice.","Crime, Drama, Mystery",1997
Heat,A group of professional bank robbers start to feel the heat from police when they unknowingly leave a clue at their latest heist.,"Crime, Drama, Thriller",1995
Casino,"A tale of greed, deception, money, power, and murder occur between two best friends: a mafia enforcer and a casino executive, compete against each other over a gambling empire, and over a fast living and fast loving socialite.","Crime, Drama",1995
Unforgiven,"Retired Old West gunslinger William Munny (Clint Eastwood) reluctantly takes on one last job, with the help of his old partner Ned Logan (Morgan Freeman) and a young man, The ""Schofield Kid"" (Jaimz Woolvett).","Drama, Western",1992
Indiana Jones and the Last Crusade,"In 1938, after his father Professor Henry Jones, Sr. goes missing while pursuing the Holy Grail, Professor Henry ""Indiana"" Jones, Jr. finds himself up against Adolf Hitler's Nazis again to stop them from obtaining its powers.","Action, Adventure",1989
Die Hard,An NYPD officer tries to save his wife and several others taken hostage by German terrorists during a Christmas party at the Nakatomi Plaza in Los Angeles.,"Action, Thriller",1988
Raging Bull,"The life of boxer Jake LaMotta, whose violence and temper that led him to the top in the ring destroyed his life outside of it.","Biography, Drama, Sport",1980
A Woman Under the Influence,"Mabel, a wife and mother, is loved by her husband Nick but her mental illness proves to be a problem in the marriage.","Drama, Romance",1974
Chinatown,"A private detective hired to expose an adulterer finds himself caught up in a web of deceit, corruption, and murder.","Drama, Mystery, Thriller",1974
The Great Escape,Allied prisoners of war plan for several hundred of their number to escape from a German camp during World War II.,"Adventure, Drama, History",1963
To Kill a Mockingbird,"Atticus Finch, a lawyer in the Depression-era South, defends a black man against an undeserved rape charge, and his children against prejudice.","Crime, Drama",1962
Judgment at Nuremberg,"In 1948, an American court in occupied Germany tries four Nazis judged for war crimes.","Drama, War",1961
Togo,"The story of Togo, the sled dog who led the 1925 serum run yet was considered by most to be too small and weak to lead such an intense race.","Adventure, Biography, Drama",2019
Logan,"In a future where mutants are nearly extinct, an elderly and weary Logan leads a quiet life. But when Laura, a mutant child pursued by scientists, comes to him for help, he must get her to safety.","Action, Drama, Sci-Fi",2017
Room,"Held captive for 7 years in an enclosed space, a woman and her young son finally gain their freedom, allowing the boy to experience the outside world for the first time.","Drama, Thriller",2015
The Grand Budapest Hotel,"A writer encounters the owner of an aging high-class hotel, who tells him of his early years serving as a lobby boy in the hotel's glorious years under an exceptional concierge.","Adventure, Comedy, Crime",2014
Gone Girl,"With his wife's disappearance having become the focus of an intense media circus, a man sees the spotlight turned on him when it's suspected that he may not be innocent.","Drama, Mystery, Thriller",2014
Hacksaw Ridge,"World War II American Army Medic Desmond T. Doss, who served during the Battle of Okinawa, refuses to kill people, and becomes the first man in American history to receive the Medal of Honor without firing a shot.","Biography, Drama, History",2016
Inside Out,"After young Riley is uprooted from her Midwest life and moved to San Francisco, her emotions - Joy, Fear, Anger, Disgust and Sadness - conflict on how best to navigate a new city, house, and school.","Animation, Adventure, Comedy",2015
12 Years a Slave,"In the antebellum United States, Solomon Northup, a free black man from upstate New York, is abducted and sold into slavery.","Biography, Drama, History",2013
Rush,The merciless 1970s rivalry between Formula One rivals James Hunt and Niki Lauda.,"Biography, Drama, Sport",2013
Ford v Ferrari,American car designer Carroll Shelby and driver Ken Miles battle corporate interference and the laws of physics to build a revolutionary race car for Ford in order to defeat Ferrari at the 24 Hours of Le Mans in 1966.,"Action, Biography, Drama",2019
Spotlight,"The true story of how the Boston Globe uncovered the massive scandal of child molestation and cover-up within the local Catholic Archdiocese, shaking the entire Catholic Church to its core.","Biography, Crime, Drama",2015
The Help,"An aspiring author during the civil rights movement of the 1960s decides to write a book detailing the African American maids' point of view on the white families for which they work, and the hardships they go through on a daily basis.",Drama,2011
Prisoners,"When Keller Dover's daughter and her friend go missing, he takes matters into his own hands as the police pursue multiple leads and the pressure mounts.","Crime, Drama, Mystery",2013
Mad Max: Fury Road,"In a post-apocalyptic wasteland, a woman rebels against a tyrannical ruler in search for her homeland with the aid of a group of female prisoners, a psychotic worshiper, and a drifter named Max.","Action, Adventure, Sci-Fi",2015
Gran Torino,"Disgruntled Korean War veteran Walt Kowalski sets out to reform his neighbor, Thao Lor, a Hmong teenager who tried to steal Kowalski's prized possession: a 1972 Gran Torino.",Drama,2008
Harry Potter and the Deathly Hallows: Part 2,"Harry, Ron, and Hermione search for Voldemort's remaining Horcruxes in their effort to destroy the Dark Lord as the final battle rages on at Hogwarts.","Adventure, Drama, Fantasy",2011
Shutter Island,"In 1954, a U.S. Marshal investigates the disappearance of a murderer who escaped from a hospital for the criminally insane.","Mystery, Thriller",2010
Hachi: A Dog's Tale,A college professor bonds with an abandoned dog he takes into his home.,"Drama, Family",2009
How to Train Your Dragon,"A hapless young Viking who aspires to hunt dragons becomes the unlikely friend of a young dragon himself, and learns there may be more to the creatures than he assumed.","Animation, Action, Adventure",2010
Elite Squad,"In 1997 Rio de Janeiro, Captain Nascimento has to find a substitute for his position while trying to take down drug dealers and criminals before the Pope visits.","Action, Crime, Drama",2007
Into the Wild,"After graduating from Emory University, top student and athlete Christopher McCandless abandons his possessions, gives his entire $24,000 savings account to charity and hitchhikes to Alaska to live in the wilderness. Along the way, Christopher encounters a series of characters that shape his life.","Adventure, Biography, Drama",2007
No Country for Old Men,Violence and mayhem ensue after a hunter stumbles upon a drug deal gone wrong and more than two million dollars in cash near the Rio Grande.,"Crime, Drama, Thriller",2007
Million Dollar Baby,A determined woman works with a hardened boxing trainer to become a professional.,"Drama, Sport",2004
Kill Bill: Vol. 1,"After awakening from a four-year coma, a former assassin wreaks vengeance on the team of assassins who betrayed her.","Action, Crime, Thriller",2003
Finding Nemo,"After his son is captured in the Great Barrier Reef and taken to Sydney, a timid clownfish sets out on a journey to bring him home.","Animation, Adventure, Comedy",2003
Catch Me If You Can,"A seasoned FBI agent pursues Frank Abagnale Jr. who, before his 19th birthday, successfully forged millions of dollars' worth of checks while posing as a Pan Am pilot, a doctor, and a legal prosecutor.","Biography, Crime, Drama",2002
The Sixth Sense,A boy who communicates with spirits seeks the help of a disheartened child psychologist.,"Drama, Mystery, Thriller",1999
The Truman Show,An insurance salesman discovers his whole life is actually a reality TV show.,"Comedy, Drama, Sci-Fi",1998
The Big Lebowski,"Jeff ""The Dude"" Lebowski, mistaken for a millionaire of the same name, seeks restitution for his ruined rug and enlists his bowling buddies to help get it.","Comedy, Crime, Sport",1998
Fargo,Jerry Lundegaard's inept crime falls apart due to his and his henchmen's bungling and the persistent police work of the quite pregnant Marge Gunderson.,"Crime, Drama, Thriller",1996
Underground,"A group of Serbian socialists prepares for the war in a surreal underground filled by parties, tragedies, love and hate.","Comedy, Drama, War",1995
