titles,summary,genre,year
My Blueberry Nights,A young lonely woman takes a soul-searching journey across America to resolve her questions about love while encountering a series of offbeat characters along the way.,"Drama, Romance",2007
10 Items or Less,"An actor (Freeman) prepping for an upcoming role meets a quirky grocery clerk (Vega), and the pair hit the road to show one another their respective worlds.","Comedy, Drama",2006
Fanboys,Star Wars fanatics take a cross-country trip to George Lucas' Skywalker Ranch so their dying friend can see a screening of Star Wars: Episode I - The Phantom Menace (1999) before its release.,"Adventure, Comedy, Drama",2009
Pride and Glory,"A family's moral codes are tested when Ray Tierney investigates a case that reveals an incendiary police corruption scandal involving his own brother-in-law. For Ray, the truth is revelatory, a Pandora's Box that threatens to upend not only the Tierney legacy but the entire NYPD.","Crime, Drama, Thriller",2008
Harold & Kumar Escape from Guantanamo Bay,"After being mistaken for terrorists and thrown into Guantánamo Bay, stoners Harold and Kumar escape and return to the U.S., where they proceed to flee across the country with federal agents in hot pursuit.","Adventure, Comedy",2008
Madagascar: Escape 2 Africa,"The Madagascar animals fly back to New York City, but crash-land on an African nature reserve, where they meet others of their own kind, and Alex especially discovers his royal heritage as prince of a lion pride.","Animation, Adventure, Comedy",2008
Rocket Science,"Looking for answers to life's big questions, a stuttering boy joins his high school debate team.","Comedy, Drama",2007
Prince of Persia: The Sands of Time,A young fugitive prince and princess must stop a villain who unknowingly threatens to destroy the world with a special dagger that enables the magic sand inside to reverse time.,"Action, Adventure, Fantasy",2010
The Mechanic,An elite hitman teaches his trade to an apprentice who has a connection to one of his previous victims.,"Action, Thriller",2011
X-Men Origins: Wolverine,"The early years of James Logan, featuring his rivalry with his brother Victor Creed, his service in the special forces team Weapon X, and his experimentation into the metal-lined mutant Wolverine.","Action, Adventure, Sci-Fi",2009
Australia,"Set in northern Australia before World War II, an English aristocrat who inherits a sprawling ranch reluctantly pacts with a stock-man in order to protect her new property from a takeover plot. As the pair drive 2,000 head of cattle over unforgiving landscape, they experience the bombing of Darwin, Australia, by Japanese forces firsthand.","Adventure, Comedy, Drama",2008
16 Blocks,"An aging alcoholic cop is assigned the task of escorting a witness from police custody to a courthouse 16 blocks away. There are, however, chaotic forces at work that prevent them from making it in one piece.","Action, Crime, Drama",2006
Puss in Boots,"An outlaw cat, his childhood egg-friend and a seductive thief kitty set out in search for the eggs of the fabled Golden Goose to clear his name, restore his lost honor and regain the trust of his mother and town.","Animation, Adventure, Comedy",2011
Take the Lead,The real story of a dance teacher who believed in the talent of a group of problem kids.,"Drama, Music",2006
Vantage Point,The attempted assassination of the American President is told and re-told from several different perspectives.,"Action, Crime, Drama",2008
Paper Man,A washed-up writer forms an unlikely friendship with a teenager from Long Island.,"Comedy, Drama",2009
Saw II,A detective and his team must rescue 8 people trapped in a factory by the twisted serial killer known as Jigsaw.,"Horror, Mystery",2005
Hairspray,Pleasantly plump teenager Tracy Turnblad teaches 1962 Baltimore a thing or two about integration after landing a spot on a local TV dance show.,"Comedy, Drama, Musical",2007
"Run, Fat Boy, Run","Five years after jilting his pregnant fiancée on their wedding day, out-of-shape Dennis decides to run a marathon to win her back.","Comedy, Romance, Sport",2007
Flushed Away,"The story of an uptown rat that gets flushed down the toilet from his penthouse apartment, ending in the sewers of London, where he has to learn a whole new and different way of life.","Animation, Adventure, Comedy",2006
Sherrybaby,Sherry tries to integrate again into society and become a good mother.,Drama,2006
Factotum,"This drama centers on Hank Chinaski, the fictional alter-ego of ""Factotum"" author Charles Bukowski, who wanders around Los Angeles, CA trying to live off jobs which don't interfere with his primary interest, which is writing. Along the way, he fends off the distractions offered by women, drinking and gambling.","Comedy, Drama, Romance",2005
Talladega Nights: The Ballad of Ricky Bobby,"Number one NASCAR driver Ricky Bobby stays atop the heap thanks to a pact with his best friend and teammate, Cal Naughton, Jr. But when a French Formula One driver, makes his way up the ladder, Ricky Bobby's talent and devotion are put to the test.","Comedy, Sport",2006
John Carter,"Transported to Barsoom, a Civil War vet discovers a barren planet seemingly inhabited by 12-foot tall barbarians. Finding himself prisoner of these creatures, he escapes, only to encounter Woola and a princess in desperate need of a savior.","Action, Adventure, Sci-Fi",2012
Derailed,"When two married business executives having an affair are blackmailed by a violent criminal, the two must turn the tables on him to save their families.","Crime, Drama, Thriller",2005
A Lot Like Love,Unaquainted Emily and Oliver join the mile high club together on the way from LAX to NYC - end of story except they meet on and off the next 7 years. Are they meant for each other?,"Comedy, Drama, Romance",2005
30 Days of Night,"After an Alaskan town is plunged into darkness for a month, it is attacked by a bloodthirsty gang of vampires.","Action, Horror, Thriller",2007
King of California,An unstable dad who after getting out of a mental institution tries to convince his daughter that there's Spanish gold buried somewhere under suburbia.,"Comedy, Drama",2007
Idiocracy,"Private Joe Bauers, the definition of ""average American"", is selected by the Pentagon to be the guinea pig for a top-secret hibernation program. Forgotten, he awakes five centuries in the future. He discovers a society so incredibly dumbed down that he's easily the most intelligent person alive.","Adventure, Comedy, Sci-Fi",2006
Hitch,"While helping his latest client woo the woman of his dreams, a professional ""date doctor"" finds that his game doesn't quite work on the gossip columnist with whom he's smitten.","Comedy, Romance",2005
Monster House,"Three teens discover that their neighbor's house is really a living, breathing, scary monster.","Animation, Adventure, Comedy",2006
The Da Vinci Code,"A murder inside the Louvre, and clues in Da Vinci paintings, lead to the discovery of a religious mystery protected by a secret society for two thousand years, which could shake the foundations of Christianity.","Mystery, Thriller",2006
The Manchurian Candidate,"In the midst of the Gulf War, soldiers are kidnapped and brainwashed for sinister purposes.","Drama, Mystery, Sci-Fi",2004
Charlie and the Chocolate Factory,"A young boy wins a tour through the most magnificent chocolate factory in the world, led by the world's most unusual candy maker.","Adventure, Comedy, Family",2005
Secret Window,A successful writer in the midst of a painful divorce is stalked at his remote lake house by a would-be scribe who accuses him of plagiarism.,"Drama, Mystery, Thriller",2004
The Ballad of Jack and Rose,A father and daughter isolated on an island off the East Coast and living on a once-thriving commune grapple with the limits of family and sexuality.,Drama,2005
I Heart Huckabees,"A husband-and-wife team play detective, but not in the traditional sense. Instead, the happy duo helps others solve their existential issues, the kind that keep you up at night, wondering what it all means.",Comedy,2004
EuroTrip,"Dumped by his girlfriend, a high school grad decides to embark on an overseas adventure in Europe with his friends.",Comedy,2004
De-Lovely,"Inspecting a magical biographical stage musical, composer Cole Porter reviews his life and career with his wife, Linda.","Biography, Drama, Music",2004
The Door in the Floor,A writer's young assistant becomes both pawn and catalyst in his boss's disintegrating household.,"Comedy, Drama",2004
Hostage,"When a family is held hostage, former hostage negotiator Jeff Talley arrives at the scene. Talley's own family is kidnapped and Talley must decide which is more important: saving a family he doesn't even know or saving his own family.","Action, Crime, Drama",2005
The Polar Express,"On Christmas Eve, a young boy embarks on a magical adventure to the North Pole on the Polar Express, while learning about friendship, bravery, and the spirit of Christmas.","Animation, Adventure, Comedy",2004
Wonderland,"In the police investigation of a brutal crime scene, one man was at the center of it all: legendary porn star John Holmes.","Crime, Drama, Mystery",2003
Thumbsucker,Justin throws himself and everyone around him into chaos when he attempts to break free from his addiction to his thumb.,"Comedy, Drama",2005
Tears of the Sun,A Special-Ops commander leads his team into the Nigerian jungle in order to rescue a doctor who will only join them if they agree to save 70 refugees too.,"Action, Drama, Thriller",2003
May,A socially awkward veterinary assistant with a lazy eye and obsession with perfection descends into depravity after developing a crush on a boy with perfect hands.,"Comedy, Drama, Horror",2002
Auto Focus,The life of TV star Bob Crane and his strange friendship with electronics expert John Henry Carpenter.,"Biography, Crime, Drama",2002
The Recruit,A brilliant young CIA trainee is asked by his mentor to help find a mole in the Agency.,"Action, Thriller",2003
Bend It Like Beckham,The daughter of orthodox Sikh rebels against her parents' traditionalism and joins a football team.,"Comedy, Drama, Romance",2002
Tuck Everlasting,A young woman meets and falls in love with a young man who is part of a family of immortals.,"Drama, Family, Fantasy",2002
Dark Blue,A robbery homicide investigation triggers a series of events that will cause a corrupt LAPD officer to question his tactics.,"Crime, Drama, Thriller",2002
Hollywood Ending,"A director is forced to work with his ex-wife, who left him for the boss of the studio bankrolling his new film. But the night before the first day of shooting, he develops a case of psychosomatic blindness.","Comedy, Romance",2002
Kiss of the Dragon,A betrayed intelligence officer enlists the aid of a prostitute to prove his innocence from a deadly conspiracy while returning a favor to her.,"Action, Crime, Drama",2001
Rush Hour 2,"Carter and Lee head to Hong Kong for a vacation, but become embroiled in a counterfeit money scam.","Action, Comedy, Crime",2001
Ripley's Game,A dying family man in need of money is persuaded to assassinate a European crime boss.,"Crime, Drama, Mystery",2002
Wet Hot American Summer,"Set on the last day of camp, in the hot summer of 1981, a group of counselors try to complete their unfinished business before the day ends.","Comedy, Romance",2001
The Gift,A woman with extrasensory perception is asked to help find a young woman who has disappeared.,"Drama, Fantasy, Horror",2000
Joy Ride,"Three young people on a road trip from Colorado to New Jersey talk to a trucker on their CB radio, then must escape when he turns out to be a psychotic killer.","Mystery, Thriller",2001
Animal Factory,"A young man goes to prison and a tough, older convict takes him under his wing as a mentor.","Crime, Drama",2000
The Replacements,"During a pro football strike, the owners hire substitute players.","Comedy, Sport",2000
The Big Kahuna,"Two veteran salesmen dissect a sales pitch to a particular client, through their young protégé.","Drama, Comedy",1999
Shanghai Noon,"A Chinese man travels to the Wild West to rescue a kidnapped Princess. After teaming up with a train robber, the unlikely duo takes on a Chinese traitor and his corrupt boss.","Action, Adventure, Comedy",2000
"Me, Myself & Irene",A nice-guy cop with Dissociative Identity Disorder must protect a woman on the run from a corrupt ex-boyfriend and his associates.,Comedy,2000
But I'm a Cheerleader,A naive teenager is sent to rehab camp when her straitlaced parents and friends suspect her of being a lesbian.,"Comedy, Drama, Romance",1999
Moonlight Mile,"As he copes with the death of his fiancée, a young man befriends her parents and must figure out what he wants out of life.","Drama, Romance",2002
Bad Boys II,Two loose-cannon narcotics cops investigate the flow of Ecstasy into Florida from a Cuban drug cartel.,"Action, Comedy, Crime",2003
What Lies Beneath,The wife of a university research scientist believes that her lakeside Vermont home is haunted by a ghost - or that she is losing her mind.,"Drama, Fantasy, Horror",2000
Drop Dead Gorgeous,A small-town beauty pageant turns deadly as it becomes clear that someone will go to any lengths to win.,"Comedy, Romance, Thriller",1999
Austin Powers: The Spy Who Shagged Me,"Dr. Evil is back and has invented a new time machine that allows him to go back to the 1960s and steal Austin Powers' mojo, inadvertently leaving him ""shagless"".","Action, Adventure, Comedy",1999
U-571,A German submarine is boarded by disguised American submariners trying to capture their Enigma cipher machine.,"Action, War",2000
True Crime,Can an over-the-hill journalist uncover the evidence that can prove a death row inmate's innocence just hours before his execution?,"Crime, Drama, Mystery",1999
You've Got Mail,Two business rivals who despise each other in real life unwittingly fall in love over the Internet.,"Comedy, Drama, Romance",1998
Instinct,"When noted anthropologist Dr. Ethan Powell, who left society to live in the jungle is imprisoned for murder, it's up to young psychiatrist Theo Caulder to get through to him.","Drama, Thriller",1999
For Love of the Game,"After 19 years of playing the game he's loved his whole life, Detroit Tigers pitcher Billy Chapel has to decide if he's going to risk everything and put everything out there.","Drama, Romance, Sport",1999
Blast from the Past,A naive man comes out into the world after spending 35 years in a nuclear fallout shelter.,"Comedy, Drama, Romance",1999
Lethal Weapon 4,"With personal crises and age weighing in on them, LAPD officers Riggs and Murtaugh must contend with deadly Chinese triads that are trying to free their former leaders out of prison and onto American soil.","Action, Crime, Thriller",1998
Titan A.E.,A young man learns that he has to find a hidden Earth ship before an enemy alien species does in order to secure the survival of humanity.,"Animation, Action, Adventure",2000
U.S. Marshals,"U.S. Marshal Samuel Gerard and his team of Marshals are assigned to track down Sheridan, who has been accused of a double-murder.","Action, Crime, Thriller",1998
Slums of Beverly Hills,"In 1976, a lower-middle-class teenager struggles to cope living with her neurotic family of nomads on the outskirts of Beverly Hills.","Comedy, Drama",1998
Jakob the Liar,"During World War II, an ordinary inhabitant of a ghetto fakes news about Allied offensives to inspire hope for other victims of the Nazi regime.","Drama, War",1999
The 13th Warrior,"A man, having fallen in love with the wrong woman, is sent by the sultan himself on a diplomatic mission to a distant land as an ambassador. Stopping at a Viking village port to restock on supplies, he finds himself unwittingly embroiled in a quest to banish a mysterious threat in a distant Viking land.","Action, Adventure, History",1999
A Civil Action,"A tenacious lawyer takes on a case involving a major company responsible for causing several people to be diagnosed with leukemia due to the town's water supply being contaminated, at the risk of bankrupting his firm and career.",Drama,1998
Primary Colors,A man joins the political campaign of a smooth-operator candidate for President of the U.S.,"Comedy, Drama",1998
Midnight in the Garden of Good and Evil,"A visiting city reporter's (John Cusack's) assignment suddenly revolves around the murder trial of a local millionaire (Kevin Spacey), whom he befriends.","Crime, Drama, Mystery",1997
The Lost World: Jurassic Park,"A research team is sent to the Jurassic Park Site B island to study the dinosaurs there, while an InGen team approaches with another agenda.","Action, Adventure, Sci-Fi",1997
Kiss the Girls,Police hunting for a serial kidnapper are helped when a victim manages to escape for the first time.,"Crime, Drama, Mystery",1997
The Horse Whisperer,The mother of a severely traumatized daughter enlists the aid of a unique horse trainer to help the girl's equally injured horse.,"Drama, Romance, Western",1998
Clay Pigeons,"After hearing that his wife sleeps with Clay, Earl kills himself, making it look like Clay shot him. She doesn't like it when Clay sees another woman instead. Bodies start piling up.","Comedy, Crime",1998
White Squall,Teenage boys discover discipline and camaraderie on an ill-fated sailing voyage.,"Adventure, Drama",1996
Ransom,Multimillionaire Tom Mullen decides to take matters into his own hands after his beloved son is kidnapped.,"Action, Crime, Thriller",1996
The Mirror Has Two Faces,"A shy, middle-aged professor enters into a romantic but non-physical relationship with an unlucky-in-love colleague.","Comedy, Drama, Romance",1996
Emma,"While matchmaking for friends and neighbours, a young 19th Century Englishwoman nearly misses her own chance at love.","Comedy, Drama, Romance",1996
Don't Be a Menace to South Central While Drinking Your Juice in the Hood,"A parody of several U.S. films about being in the 'Hood', for instance ""Boyz n the Hood"", ""South Central"", ""Menace II Society"", ""Higher Learning"" and ""Juice"".","Comedy, Crime",1996
Courage Under Fire,"A U.S. Army officer, despondent about a deadly mistake he made, investigates a female chopper commander's worthiness for the Medal of Honor.","Action, Drama, Mystery",1996
"To Wong Foo Thanks for Everything, Julie Newmar","Three drag queens travel cross-country until their car breaks down, leaving them stranded in a small town.","Comedy, Drama",1995
Powder,An off the charts genius who is home schooled and shunned after his last relative dies shows the unconscious residents of his town about connection awareness and the generosity of the spirit.,"Drama, Fantasy, Mystery",1995
Outbreak,Army doctors struggle to find a cure for a deadly virus spreading throughout a California town that was brought to America by an African monkey.,"Action, Drama, Thriller",1995
Home for the Holidays,"After losing her job, making out with her soon-to-be former boss, and finding out that her daughter plans to spend Thanksgiving with her boyfriend, Claudia Larson faces spending the holiday with her family.","Comedy, Drama, Romance",1995
French Kiss,"A woman flies to France to confront her straying fiancee, but gets into trouble when the charming crook seated next to her uses her for smuggling.","Comedy, Drama, Romance",1995
Copycat,An agoraphobic psychologist and a female detective must work together to take down a serial killer who copies serial killers from the past.,"Drama, Mystery, Thriller",1995
When a Man Loves a Woman,The seemingly perfect relationship between a man and his wife is tested as a result of her alcoholism.,"Drama, Romance",1994
Star Trek: Generations,"With the help of long presumed dead Captain Kirk, Captain Picard must stop a deranged scientist willing to murder on a planetary scale in order to enter a space matrix.","Action, Adventure, Mystery",1994
Reality Bites,"A documentary filmmaker and her fellow Generation X graduates face life after college, looking for work and love in Houston.","Comedy, Drama, Romance",1994
The Paper,"New York City tabloid editor Henry's faced with tough decisions while he faces several serious life challenges, and a tempting job offer.","Comedy, Drama",1994
PCU,"A high school senior visits college for the weekend, and stays at the wildest house on campus in this classic tale of anti-political-correctness.",Comedy,1994
Heavyweights,"Plump kids are lured into joining a posh fat camp with the promise of quick weight loss and good times, only to find that the facility is a woodland hellhole run by a psycho ex-fitness instructor.","Comedy, Drama, Family",1995
"Corrina, Corrina","In 1959, a widower hires a kindly housekeeper/nanny to care for his seven-year-old daughter.","Comedy, Drama, Romance",1994
Above the Rim,"Story of a promising high school basketball star and his relationships with two brothers, one a drug dealer and the other a former basketball star fallen on hard times and now employed as a security guard.","Crime, Drama, Sport",1994
Romeo Is Bleeding,"A womanizing, crooked cop on the payroll of the mafia is confronted with the reality of his double life after he is asked to kill a beautiful and ruthless Russian gangster.","Crime, Drama, Romance",1993
The Pelican Brief,"A law student uncovers a conspiracy, putting herself and others in danger.","Crime, Drama, Mystery",1993
Judgment Night,"Four friends on their way to a boxing match get caught in heavy traffic, so they take a shortcut in order to get there faster, unfortunately it leads to them witnessing a murder which leaves them running for their lives.","Action, Crime, Drama",1993
Hot Shots! Part Deux,"""Rambo"" parody in which Topper Harley leads a rescue team into Iraq to save Iraqi war prisoners and all of their previous rescue teams.","Action, Comedy",1993
Fire in the Sky,An Arizona logger mysteriously disappears for five days in an alleged encounter with a flying saucer in 1975.,"Biography, Drama, Fantasy",1993
Hoffa,"The story of the notorious American labor union figure Jimmy Hoffa, who organizes a bitter strike, makes deals with members of the organized crime syndicate and mysteriously disappears in 1975.","Biography, Crime, Drama",1992
The Hand That Rocks the Cradle,"After her humiliated husband kills himself, an embittered pregnant widow loses her child, and embarks on a mission of vengeance against a woman and her family.","Drama, Thriller",1992
Far and Away,"A young Irish couple flee to the States, but subsequently struggle to obtain land and prosper freely.","Adventure, Drama, Romance",1992
Death Becomes Her,"When a woman learns of an immortality treatment, she sees it as a way to outdo her long-time rival.","Comedy, Fantasy, Horror",1992
Candyman,"The Candyman, a murderous soul with a hook for a hand, is accidentally summoned to reality by a skeptic grad student researching the monster's myth.","Horror, Thriller",1992
Toy Soldiers,A group of troublemaking boys decide to take a stand when terrorists seize control of their boarding school.,"Action, Drama, Thriller",1991
Soapdish,"An ambitious television soap actress connives with her producer to scuttle the career of the show's long-time star, but nothing works as they plan.","Comedy, Romance",1991
Little Man Tate,"Fred Tate is a prodigy. He's also a lonely, little boy with the emotional needs that his single mom covers. Worries about world problems gives him ulcer. He takes a quantum physics summer college class at 7.",Drama,1991
White Hunter Black Heart,"A thinly fictionalized account of a legendary movie director, whose desire to hunt down an animal turns into a grim situation with his movie crew in Africa.","Adventure, Drama",1990
Nightbreed,"A troubled young man is drawn to a mythical place called Midian where a variety of friendly monsters are hiding from humanity. Meanwhile, a sadistic serial killer is looking for a patsy.","Action, Fantasy, Horror",1990
Mo' Better Blues,Jazz trumpeter Bleek Gilliam makes questionable decisions in his professional and romantic lives.,"Drama, Music, Romance",1990
Flatliners,"Five medical students experiment with ""near death"" experiences, until the dark consequences of past tragedies begin to jeopardize their lives.","Drama, Horror, Sci-Fi",1990
Alice,A spoiled Manhattan housewife re-evaluates her life after visiting a Chinatown healer.,"Comedy, Romance",1990
Road House,A tough bouncer is hired to tame a dirty bar.,"Action, Thriller",1989
Pet Sematary,"After tragedy strikes, a grieving father discovers an ancient burial ground behind his home with the power to raise the dead.","Horror, Thriller",1989
Licence to Kill,"After capturing a drug lord, Felix Leiter is left for dead and his wife is murdered. James Bond goes rogue and seeks vengeance on those responsible, as he infiltrates an organisation posing as a hitman.","Action, Adventure, Thriller",1989
Ghostbusters II,The discovery of a massive river of ectoplasm and a resurgence of spectral activity allows the staff of Ghostbusters to revive the business.,"Action, Comedy, Fantasy",1989
I'm Gonna Git You Sucka,"In this parody of blaxploitation movies, a black hero wannabe reunites former black heroes from the 70s to help him get revenge on Mr. Big.","Action, Comedy, Crime",1988
Elvira: Mistress of the Dark,"Upon arriving in a small town where she has inherited a rundown mansion, a famous horror hostess battles an evil uncle, and townspeople who want her burned at the stake.","Comedy, Horror",1988
Child's Play,"A single mother gives her son a much sought-after doll for his birthday, only to discover that it is possessed by the soul of a serial killer.","Horror, Thriller",1988
