titles,summary,genre,year
Welcome to the Dollhouse,"An awkward seventh-grader struggles to cope with inattentive parents, snobbish class-mates, a smart older brother, an attractive younger sister and her own insecurities in suburban New Jersey.","Comedy, Drama",1995
Smoke,"A Brooklyn smoke shop is the center of neighborhood activity, and the stories of its customers.","Comedy, Drama",1995
Richard III,The classic Shakespearean play about the murderously scheming 15th-century king is reimagined in an alternative setting of 1930s England as clouds of fascism gather.,"Drama, Sci-Fi, War",1995
Nobody's Fool,A stubborn man past his prime reflects on his life of strict independence and seeks more from himself.,"Comedy, Drama",1994
Immortal Beloved,"The life and death of the legendary Ludwig van Beethoven. Besides all the work he is known for, the composer once wrote a famous love letter to a nameless beloved, and the movie tries to ... See full summary »","Biography, Drama, Music",1994
Dolores Claiborne,A big-city reporter travels to the small town where her mother has been arrested for the murder of an elderly woman that she works for as a maid.,"Crime, Drama, Mystery",1995
Bullets Over Broadway,"In New York in 1928, a struggling playwright is forced to cast a mobster's talentless girlfriend in his latest drama in order to get it produced.","Comedy, Crime",1994
Searching for Bobby Fischer,A prepubescent chess prodigy refuses to harden himself in order to become a champion like the famous but unlikable Bobby Fischer.,"Biography, Drama",1993
Manhattan Murder Mystery,A middle-aged couple suspects foul play when their neighbor's wife suddenly drops dead.,"Comedy, Mystery",1993
Howards End,A businessman thwarts his wife's bequest of an estate to another woman.,"Drama, Romance",1992
Dracula,The centuries old vampire Count Dracula comes to England to seduce his barrister Jonathan Harker's fiancée Mina Murray and inflict havoc in the foreign land.,Horror,1992
The Man in the Moon,A coming of age story set in the south of the U.S. when Elvis was King.,"Drama, Romance",1991
Back to the Future Part III,"Stranded in 1955, Marty McFly learns about the death of Doc Brown in 1885 and must travel back in time to save him. With no fuel readily available for the DeLorean, the two must figure how to escape the Old West before Emmett is murdered.","Adventure, Comedy, Sci-Fi",1990
Lean on Me,The dedicated but tyrannical Joe Clark is appointed the principal of a decaying inner-city school and he is determined to improve by any and all means.,Drama,1989
Driving Miss Daisy,An old Jewish woman and her African-American chauffeur in the American South have a relationship that grows and improves over the years.,Drama,1989
The Land Before Time,An orphaned brontosaurus teams up with other young dinosaurs in order to reunite with their families in a valley.,"Animation, Adventure, Drama",1988
Dirty Rotten Scoundrels,Two con men try to settle their rivalry by betting on who can swindle a young American heiress out of fifty thousand dollars first.,"Comedy, Crime",1988
Wall Street,"A young and impatient stockbroker is willing to do anything to get to the top, including trading on illegal inside information taken through a ruthless and greedy corporate raider who takes the youth under his wing.","Crime, Drama",1987
Salvador,An American photojournalist gets caught in a political struggle at El Salvador in 1980.,"Drama, History, Thriller",1986
Labyrinth,Sixteen-year-old Sarah is given thirteen hours to solve a labyrinth and rescue her baby brother Toby when her wish for him to be taken away is granted by the Goblin King Jareth.,"Adventure, Family, Fantasy",1986
Witness,"When a young Amish boy is sole witness to a murder, policeman John Book goes into hiding in Amish country to protect him until the trial.","Crime, Drama, Romance",1985
Kiss of the Spider Woman,A gay man and a political prisoner are together in a prison. The gay man narrates the stories of two fake movies and his own life.,Drama,1985
Broadway Danny Rose,"In his attempts to reconcile a lounge singer with his mistress, a hapless talent agent is mistaken as her lover by a jealous gangster.",Comedy,1984
Terms of Endearment,"Follows hard-to-please Aurora looking for love, and her daughter's family problems.","Comedy, Drama",1983
National Lampoon's Vacation,The Griswold family's cross-country drive to the Walley World theme park proves to be much more arduous than they ever anticipated.,"Adventure, Comedy",1983
Tootsie,"Michael Dorsey, an unsuccessful actor, disguises himself as a woman in order to get a role on a trashy hospital soap.","Comedy, Drama, Romance",1982
Thief,"Coming closer to his dream of leading a normal life, a professional safecracker agrees to do a job for the Mafia, who has other plans for him.","Action, Crime, Drama",1981
Excalibur,"Merlin the magician helps Arthur Pendragon unite the Britons around the Round Table of Camelot, even as dark forces conspire to tear it apart.","Adventure, Drama, Fantasy",1981
Body Heat,"In the midst of a searing Florida heat wave, a woman persuades her lover, a small-town lawyer, to murder her rich husband.","Crime, Drama, Romance",1981
Blow Out,A movie sound recordist accidentally records the evidence that proves that a car accident was actually murder and consequently finds himself in danger.,"Mystery, Thriller",1981
The China Syndrome,A reporter finds what appears to be a cover-up of safety hazards at a nuclear power plant.,"Drama, Thriller",1979
And Justice for All,"A lawyer is forced to defend a guilty judge, while defending other innocent clients, and trying to find punishment for the guilty and provide justice for the innocent.","Crime, Drama, Thriller",1979
Invasion of the Body Snatchers,"When seeds drift to earth from space, mysterious pods begin to grow and invade a small town, replicating the residents one body at a time.","Horror, Sci-Fi",1978
Interiors,"Three sisters find their lives spinning out of control in the wake of their parents' sudden, unexpected divorce.",Drama,1978
The Goodbye Girl,"After being dumped by her live-in boyfriend, an unemployed dancer and her 10-year-old daughter are reluctantly forced to live with a struggling off-Broadway actor.","Comedy, Drama, Romance",1977
A Bridge Too Far,"Operation Market Garden, September 1944: The Allies attempt to capture several strategically important bridges in the Netherlands in the hope of breaking the German lines.","Drama, History, War",1977
Murder by Death,Five famous literary detective characters and their sidekicks are invited to a bizarre mansion to solve an even stranger mystery.,"Comedy, Crime, Mystery",1976
The Killing of a Chinese Bookie,"A proud strip club owner is forced to come to terms with himself as a man, when his gambling addiction gets him in hot water with the mob, who offer him only one alternative.","Crime, Drama, Thriller",1976
Eraserhead,"Henry Spencer tries to survive his industrial environment, his angry girlfriend, and the unbearable screams of his newly born mutant child.",Horror,1977
Carrie,"Carrie White, a shy, friendless teenage girl who is sheltered by her domineering, religious mother, unleashes her telekinetic powers after being humiliated by her classmates at her senior prom.",Horror,1976
Assault on Precinct 13,"An unlikely partnership between a Highway Patrol Officer, two criminals and a station secretary is formed to defend a defunct Los Angeles precinct office against a siege by a bloodthirsty street gang.","Action, Crime, Thriller",1976
Three Days of the Condor,"A bookish CIA researcher finds all his co-workers dead, and must outwit those responsible until he figures out who he can really trust.","Mystery, Thriller",1975
The Rocky Horror Picture Show,A newly-engaged couple have a breakdown in an isolated area and must seek shelter at the bizarre residence of Dr. Frank-n-Furter.,"Comedy, Musical",1975
Phantom of the Paradise,"A disfigured composer sells his soul for the woman he loves so that she will perform his music. However, an evil record tycoon betrays him and steals his music to open his rock palace, The Paradise.","Comedy, Drama, Fantasy",1974
Jesus Christ Superstar,"Film version of the musical stage play, presenting the last few weeks of Christ's life told in an anachronistic manner.","Drama, History, Musical",1973
American Graffiti,A couple of high school grads spend one final night cruising the strip with their buddies before they go off to college.,"Comedy, Drama",1973
The Getaway,A recently released ex-con and his loyal wife go on the run after a heist goes awry.,"Action, Crime, Thriller",1972
The Cowboys,Rancher Wil Andersen is forced to hire inexperienced boys as cowhands in order to get his herd to market on time but the rough drive is full of dangers and a gang of cattle rustlers is trailing them.,"Adventure, Drama, Western",1972
Macbeth,A ruthlessly ambitious Scottish lord seizes the throne with the help of his scheming wife and a trio of witches.,"Biography, Drama, History",1971
True Grit,"A drunken, hard-nosed U.S. Marshal and a Texas Ranger help a stubborn teenager track down her father's murderer in Indian Territory.","Adventure, Drama, Western",1969
Yellow Submarine,The Beatles agree to accompany Captain Fred in his yellow submarine and go to Pepperland to free it from the music-hating Blue Meanies.,"Animation, Adventure, Comedy",1968
Funny Girl,"The life of Fanny Brice, famed comedienne and entertainer of the early 1900s. We see her rise to fame as a Ziegfeld girl, subsequent career, and her personal life, particularly her relationship with Nick Arnstein.","Biography, Comedy, Drama",1968
Bullitt,"An all guts, no glory San Francisco cop becomes determined to find the underworld kingpin that killed the witness in his protection.","Action, Crime, Thriller",1968
Hombre,"John Russell, disdained by his ""respectable"" fellow stagecoach passengers because he was raised by Native Americans, becomes their only hope for survival when they are set upon by outlaws.",Western,1967
Shock Corridor,"Bent on winning a Pulitzer Prize, a journalist commits himself to a mental institution to solve a strange and unclear murder.","Drama, Mystery",1963
Irma la Douce,"In Paris, a former policeman falls in love with a prostitute, and tries to get her out of that life by paying for all of her time.","Comedy, Romance",1963
Dolemite Is My Name,"Eddie Murphy portrays real-life legend Rudy Ray Moore, a comedy and rap pioneer who proved naysayers wrong when his hilarious, obscene, kung-fu fighting alter ego, Dolemite, became a 1970s Blaxploitation phenomenon.","Biography, Comedy, Drama",2019
Honey Boy,A young actor's stormy childhood and early adult years as he struggles to reconcile with his father and deal with his mental health.,Drama,2019
Hereditary,A grieving family is haunted by tragic and disturbing occurrences.,"Drama, Horror, Mystery",2018
Instant Family,A couple find themselves in over their heads when they foster three children.,"Comedy, Drama",2018
I Can Only Imagine,"The inspiring and unknown true story behind MercyMe's beloved, chart topping song that brings ultimate hope to so many is a gripping reminder of the power of true forgiveness.","Biography, Drama, Family",2018
The Ballad of Buster Scruggs,"Six tales of life and violence in the Old West, following a singing gunslinger, a bank robber, a traveling impresario, an elderly prospector, a wagon train, and a perverse pair of bounty hunters.","Comedy, Drama, Musical",2018
The Professor and the Madman,"Professor James Murray begins work compiling words for the first edition of the Oxford English Dictionary in the mid-19th century, and receives over 10,000 entries from a patient at Broadmoor Criminal Lunatic Asylum, Dr. William Minor.","Biography, Drama",2019
Blue Jay,"Meeting by chance when they return to their tiny California hometown, two former high-school sweethearts reflect on their shared past.","Drama, Romance",2016
Lucky,Lucky follows the spiritual journey of a 90-year-old atheist and the quirky characters that inhabit his off the map desert town.,"Comedy, Drama, Western",2017
Brigsby Bear,"After being freed from his life in an underground bunker, a man sets out to make a movie of the only TV show he has ever known.","Comedy, Drama",2017
The Shape of Water,"At a top secret research facility in the 1960s, a lonely janitor forms a unique relationship with an amphibious creature that is being held in captivity.","Adventure, Drama, Fantasy",2017
Official Secrets,The true story of a British whistleblower who leaked information to the press about an illegal NSA spy operation designed to push the UN Security Council into sanctioning the 2003 invasion of Iraq.,"Biography, Crime, Drama",2019
Detroit,Fact-based drama set during the 1967 Detroit riots in which a group of rogue police officers respond to a complaint with retribution rather than justice on their minds.,"Crime, Drama, History",2017
Split,Three girls are kidnapped by a man with a diagnosed 23 distinct personalities. They must try to escape before the apparent emergence of a frightful new 24th.,"Horror, Thriller",2016
Shot Caller,A newly released prisoner is forced by the leaders of his gang to orchestrate a major crime with a brutal rival gang on the streets of Southern California.,"Crime, Drama, Thriller",2017
Christopher Robin,"A working-class family man, Christopher Robin, encounters his childhood friend Winnie-the-Pooh, who helps him to rediscover the joys of life.","Comedy, Drama, Family",2018
20th Century Women,"The story of a teenage boy, his mother, and two other women who help raise him among the love and freedom of Southern California of 1979.","Comedy, Drama",2016
The Last Black Man in San Francisco,A young man searches for home in the changing city that seems to have left him behind.,Drama,2019
13 Hours,"During an attack on a U.S. compound in Libya, a security team struggles to make sense out of the chaos.","Action, Drama, History",2016
The Lego Batman Movie,"A cooler-than-ever Bruce Wayne must deal with the usual suspects as they plan to rule Gotham City, while discovering that he has accidentally adopted a teenage orphan who wishes to become his sidekick.","Animation, Action, Comedy",2017
Okja,"A young girl risks everything to prevent a powerful, multinational company from kidnapping her best friend - a fascinating beast named Okja.","Action, Adventure, Drama",2017
Snowden,"The NSA's illegal surveillance techniques are leaked to the public by one of the agency's employees, Edward Snowden, in the form of thousands of classified documents distributed to the press.","Biography, Crime, Drama",2016
The Walk,"In 1974, high-wire artist Philippe Petit recruits a team of people to help him realize his dream: to walk the immense void between the World Trade Center towers.","Adventure, Biography, Drama",2015
The End of the Tour,"The story of the five-day interview between Rolling Stone reporter David Lipsky and acclaimed novelist David Foster Wallace, which took place right after the 1996 publication of Wallace's groundbreaking epic novel, 'Infinite Jest.'","Biography, Drama",2015
Spare Parts,"Four Hispanic high school students form a robotics club. With no experience, 800 bucks, used car parts and a dream, this rag tag team goes up against the country's reigning robotics champion, MIT.",Drama,2015
A Beautiful Day in the Neighborhood,Based on the true story of a real-life friendship between Fred Rogers and journalist Lloyd Vogel.,"Biography, Drama",2019
Fantastic Beasts and Where to Find Them,The adventures of writer Newt Scamander in New York's secret community of witches and wizards seventy years before Harry Potter reads his book in school.,"Adventure, Family, Fantasy",2016
The Conjuring 2,Ed and Lorraine Warren travel to North London to help a single mother raising 4 children alone in a house plagued by a supernatural spirit.,"Horror, Mystery, Thriller",2016
The Hundred-Foot Journey,The Kadam family leaves India for France where they open a restaurant directly across the road from Madame Mallory's Michelin-starred eatery.,"Comedy, Drama",2014
Chef,"A head chef quits his restaurant job and buys a food truck in an effort to reclaim his creative promise, while piecing back together his estranged family.","Adventure, Comedy, Drama",2014
Shaun the Sheep Movie,"When Shaun decides to take the day off and have some fun, he gets a little more action than he bargained for. A mix up with the Farmer, a caravan and a very steep hill lead them all to the Big City and it's up to Shaun and the flock to return everyone safely to the green grass of home.","Animation, Adventure, Comedy",2015
The Fundamentals of Caring,A man suffering a family loss enrolls in a class about care-giving that changes his perspective on life.,"Comedy, Drama",2016
Anomalisa,A man crippled by the mundanity of his life experiences something out of the ordinary.,"Animation, Comedy, Drama",2015
Avengers: Age of Ultron,"When Tony Stark and Bruce Banner try to jump-start a dormant peacekeeping program called Ultron, things go horribly wrong and it's up to Earth's mightiest heroes to stop the villainous Ultron from enacting his terrible plan.","Action, Adventure, Sci-Fi",2015
Blue Jasmine,"A New York socialite, deeply troubled and in denial, arrives in San Francisco to impose upon her sister. She looks a million, but isn't bringing money, peace, or love...",Drama,2013
Finding Dory,"Friendly but forgetful blue tang Dory begins a search for her long-lost parents, and everyone learns a few things about the real meaning of family along the way.","Animation, Adventure, Comedy",2016
The Book of Life,"Manolo, a young man who is torn between fulfilling the expectations of his family and following his heart, embarks on an adventure that spans three fantastic worlds where he must face his greatest fears.","Animation, Adventure, Comedy",2014
American Sniper,"Navy S.E.A.L. sniper Chris Kyle's pinpoint accuracy saves countless lives on the battlefield and turns him into a legend. Back home with his family after four tours of duty, however, Chris finds that it is the war he can't leave behind.","Action, Biography, Drama",2014
The Accountant,"As a math savant uncooks the books for a new client, the Treasury Department closes in on his activities, and the body count starts to rise.","Action, Crime, Drama",2016
Beasts of the Southern Wild,"Faced with both her hot-tempered father's fading health and melting ice-caps that flood her ramshackle bayou community and unleash ancient aurochs, six-year-old Hushpuppy must learn the ways of courage and love.","Adventure, Drama, Fantasy",2012
Rocketman,A musical fantasy about the fantastical human story of Elton John's breakthrough years.,"Biography, Drama, Music",2019
Flight,"An airline pilot saves almost all his passengers on his malfunctioning airliner which eventually crashed, but an investigation into the accident reveals something troubling.","Drama, Thriller",2012
The Edge of Seventeen,"High-school life gets even more unbearable for Nadine when her best friend, Krista, starts dating her older brother.","Comedy, Drama",2016
Black Panther,"T'Challa, heir to the hidden but advanced kingdom of Wakanda, must step forward to lead his people into a new future and must confront a challenger from his country's past.","Action, Adventure, Sci-Fi",2018
The Place Beyond the Pines,"A motorcycle stunt rider turns to robbing banks as a way to provide for his lover and their newborn child, a decision that puts him on a collision course with an ambitious rookie cop navigating a department ruled by a corrupt detective.","Crime, Drama, Thriller",2012
Despicable Me 2,"When Gru, the world's most super-bad turned super-dad has been recruited by a team of officials to stop lethal muscle and a host of Gru's own, He has to fight back with new gadgetry, cars, and more minion madness.","Animation, Adventure, Comedy",2013
Now You See Me,"An F.B.I. Agent and an Interpol Detective track a team of illusionists who pull off bank heists during their performances, and reward their audiences with the money.","Crime, Mystery, Thriller",2013
The Man from U.N.C.L.E.,"In the early 1960s, CIA agent Napoleon Solo and KGB operative Illya Kuryakin participate in a joint mission against a mysterious criminal organization, which is working to proliferate nuclear weapons.","Action, Adventure, Comedy",2015
Fast Five,Dominic Toretto and his crew of street racers plan a massive heist to buy their freedom while in the sights of a powerful Brazilian drug lord and a dangerous federal agent.,"Action, Adventure, Crime",2011
Monsters University,"A look at the relationship between Mike Wazowski (Billy Crystal) and James P. ""Sully"" Sullivan (John Goodman) during their days at Monsters University, when they weren't necessarily the best of friends.","Animation, Adventure, Comedy",2013
Rise of the Guardians,"When the evil spirit Pitch launches an assault on Earth, the Immortal Guardians team up to protect the innocence of children all around the world.","Animation, Action, Adventure",2012
Submarine,"15-year-old Oliver Tate has two objectives: To lose his virginity before his next birthday, and to extinguish the flame between his mother and an ex-lover who has resurfaced in her life.","Comedy, Drama, Romance",2010
Another Year,A look at four seasons in the lives of a happily married couple and their relationships with their family and friends.,"Comedy, Drama",2010
It,"In the summer of 1989, a group of bullied kids band together to destroy a shape-shifting monster, which disguises itself as a clown and preys on the children of Derry, their small Maine town.",Horror,2017
Hwanghae,"When the attempt to kill a professor goes wrong, a series of violent events are triggered which force a taxi driver to run for his life.","Action, Crime, Drama",2010
Jane Eyre,A mousy governess who softens the heart of her employer soon discovers that he's hiding a terrible secret.,"Drama, Romance",2011
Beautiful Boy,"Based on the best-selling pair of memoirs from father and son David and Nic Sheff, Beautiful Boy chronicles the heartbreaking and inspiring experience of survival, relapse and recovery in a family coping with addiction over many years.","Biography, Drama",2018
First Man,"A look at the life of the astronaut, Neil Armstrong, and the legendary space mission that led him to become the first man to walk on the Moon on July 20, 1969.","Biography, Drama, History",2018
Lawless,"Set in Depression-era Franklin County, Virginia, a trio of bootlegging brothers are threatened by a new special deputy and other authorities angling for a cut of their profits.","Crime, Drama",2012
You're Not You,A drama centered on a classical pianist who has been diagnosed with ALS and the brash college student who becomes her caregiver.,Drama,2014
The Lincoln Lawyer,A lawyer defending a wealthy man begins to believe his client is guilty of more than just one crime.,"Crime, Drama, Thriller",2011
An Education,"A coming-of-age story about a teenage girl in 1960s suburban London, and how her life changes with the arrival of a playboy nearly twice her age.",Drama,2009
Invictus,"Nelson Mandela, in his first term as President of South Africa, initiates a unique venture to unite the Apartheid-torn land: enlist the national rugby team on a mission to win the 1995 Rugby World Cup.","Biography, Drama, History",2009
The Descendants,A land baron tries to reconnect with his two daughters after his wife is seriously injured in a boating accident.,"Comedy, Drama",2011
RocknRolla,"In London, a real-estate scam puts millions of pounds up for grabs, attracting some of the city's scrappiest tough guys and its more established underworld types, all of whom are looking to get rich quick. While the city's seasoned criminals vie for the cash, an unexpected player -- a drugged-out rock 'n' roller presumed to be dead but very much alive -- has a multi-million-dollar prize fall into... See full summary »","Action, Crime, Thriller",2008
The Way Back,Siberian gulag escapees travel four thousand miles by foot to freedom in India.,"Adventure, Drama, History",2010
The Adventures of Tintin,Intrepid reporter Tintin and Captain Haddock set off on a treasure hunt for a sunken ship commanded by Haddock's ancestor.,"Animation, Action, Adventure",2011
The Young Victoria,"A dramatization of the turbulent first years of Queen Victoria's rule, and her enduring romance with Prince Albert.","Biography, Drama, History",2009
Revolutionary Road,A young couple living in a Connecticut suburb during the mid-1950s struggle to come to terms with their personal problems while trying to raise their two children.,"Drama, Romance",2008
Precious,"In New York City's Harlem circa 1987, an overweight, abused, illiterate teen who is pregnant with her second child is invited to enroll in an alternative school in hopes that her life can head in a new direction.",Drama,2009
Lars and the Real Girl,A delusional young man strikes up an unconventional relationship with a doll he finds on the Internet.,"Comedy, Drama, Romance",2007
An American Crime,"The true story of suburban housewife Gertrude Baniszewski, who kept a teenage girl locked in the basement of her Indiana home during the 1960s.","Biography, Crime, Drama",2007
Mr. Brooks,A well-respected businessman is sometimes controlled by his murder and mayhem-loving alter ego.,"Crime, Drama, Thriller",2007
The Ultimate Gift,"A deceased billionaire leaves his spoiled adult grandson a series of odd tasks to perform in order to receive ""the ultimate gift,"" with the resentful grandson having no idea what that might be.","Drama, Family, Romance",2006
